{
  "timestamp": "2026-04-20T14:32:05Z",
  "correlation_id": "FEAT-2026-0042/T07",
  "event_type": "task_started",
  "source": "component:api",
  "source_version": "0.3.1",
  "payload": {
    "issue": "specfuse/api#418",
    "branch": "feat/FEAT-2026-0042-T07-rate-limit-headers",
    "started_by": "component-agent"
  }
}
