{
  "timestamp": "2026-04-23T20:15:00Z",
  "correlation_id": "FEAT-2026-0061",
  "event_type": "qa_regression_resolved",
  "source": "qa",
  "source_version": "1.3.0",
  "payload": {
    "implementation_task_correlation_id": "FEAT-2026-0061/T02",
    "test_id": "widgets-export-rate-limit-enforced-429",
    "filed_event_ts": "2026-04-23T18:44:00Z",
    "resolving_qa_execution_event_ts": "2026-04-23T20:14:00Z",
    "resolving_commit_sha": "0123456789abcdef0123456789abcdef01234567"
  }
}
